{
  "$schema": "sourcegraph-ai-ban-catalog.schema.json",
  "audit": {
    "agreement_fields": [
      "decision",
      "default_branch_supported",
      "policy_scope",
      "evidence_tier"
    ],
    "audited_event_count": 25,
    "auditor_id": "ai-ban-auditor-b",
    "cases": [
      {
        "audit_decision": "reject",
        "audit_response_sha256": "e4c64b7cf0b74f98f114c79cb1f9c848c6f1d2bdf2c5d150ed1a60a3ca40e022",
        "canonical_repository_id": "yt-dlp/yt-dlp",
        "event_id": "57d6f21a90f98c1b9d7b42ba950fef920a71174cc810c306d68af73aa3709814",
        "evidence_channel": "ai_ban_policy_files",
        "exact_agreement": true,
        "language": "Python",
        "primary_decision": "reject",
        "primary_response_sha256": "74f86390a7422fc4096d35b09ed3d5d028d3255332e966f7ca4857c0a337f04e",
        "task_id": "0d46888853ac83d1ced201f07c7b178f85beb8c504ade181755cb246c4d446ee"
      },
      {
        "audit_decision": "accept_policy",
        "audit_response_sha256": "4a3cb387ca4c4d6ca7d21df34f09d277338c05d02fa4e798687f3a4968d5ed9b",
        "canonical_repository_id": "borgmatic-collective/borgmatic",
        "event_id": "92a08b7ffb49377eb59cc8fdd945755886d818664dac7cadf28a60ba0baa45f2",
        "evidence_channel": "ai_ban_policy_files+ai_ban_policy_introduction_diffs",
        "exact_agreement": true,
        "language": "Python",
        "primary_decision": "accept_policy",
        "primary_response_sha256": "0ba50972c7b6a766cb39a936a06484006bb897685e5d930ae4e7174db7d83d5d",
        "task_id": "3717147ff4c4291cad67e7f0688dc1c0d5359e9d880fdd9f13cd72361489aa2b"
      },
      {
        "audit_decision": "accept_policy",
        "audit_response_sha256": "be2d9f88c3b13e19d6c89e5b22bcb4eb9e0684352a61706f56a8cdecf7395e90",
        "canonical_repository_id": "poezio/poezio",
        "event_id": "9f5d07bbeba95f21c8cc3ebf71550feab127bcd164f9a448df17aa51e24a2263",
        "evidence_channel": "ai_ban_policy_files+ai_ban_policy_introduction_diffs",
        "exact_agreement": true,
        "language": "Python",
        "primary_decision": "accept_policy",
        "primary_response_sha256": "479adbefc25f2398e2a6ff80dc7b2d1427fc79bd1ed6b2e6cfe41cf1f82e2acf",
        "task_id": "c8d6271b962276d38dca7da685391d856596f30955ad381788779ab5656732be"
      },
      {
        "audit_decision": "accept_policy",
        "audit_response_sha256": "d0246d2efa2fad71518666f5b9449c6f219c9a9750d8e178c194eb9493e0c39d",
        "canonical_repository_id": "teamtype/teamtype",
        "event_id": "6236f17219734fce35c4b29fc57da81bdbdad750fd163d821103ac18ca0d0290",
        "evidence_channel": "ai_ban_policy_files+ai_ban_policy_introduction_diffs",
        "exact_agreement": true,
        "language": "Rust",
        "primary_decision": "accept_policy",
        "primary_response_sha256": "272fe4930b82bcd0b7e918435ca5dc4d66e1494d800f26e6e216e32721ece0cb",
        "task_id": "9167aa987f620b88cf97720004531a0d281bcc301fe8807769c2a4470fc16930"
      },
      {
        "audit_decision": "reject",
        "audit_response_sha256": "eb40df480390ab60837cce6b9cd4bd8dd08ba8b0bf2adaf17ff9d8343087cd1f",
        "canonical_repository_id": "typst/typst",
        "event_id": "d152d8f2bfc5f5a1f0422f1a5b928376ddb471f7f8aea110f46f20ae3a867153",
        "evidence_channel": "ai_ban_policy_files+ai_ban_policy_introduction_diffs",
        "exact_agreement": true,
        "language": "Rust",
        "primary_decision": "reject",
        "primary_response_sha256": "5fabae46e70126c86c16ed62b65524132b52d0c0a7ac64c95d8027eebeddb038",
        "task_id": "a1ca40c34c629faad3fec672a614079acdfe652e7afd438860d8e369952f0f44"
      },
      {
        "audit_decision": "reject",
        "audit_response_sha256": "389cc7d47828dabe843c2a099026199197b63bcfa5c46d26e00b5b93bdf267b8",
        "canonical_repository_id": "bevyengine/bevy",
        "event_id": "8d39ba5a7ae855155a55a16a9834862d85557668e09b4619dcecdff4a407431c",
        "evidence_channel": "ai_ban_policy_files",
        "exact_agreement": true,
        "language": "Rust",
        "primary_decision": "reject",
        "primary_response_sha256": "dab9fd974d4a5860d3a97cd3760238b6fa3ff323ef14241aee52e222dacc7179",
        "task_id": "b38d991bf3b0f3952a81b59fae4f0ce055f1ef247b77fe7b937cb79a85caae32"
      },
      {
        "audit_decision": "reject",
        "audit_response_sha256": "95881ff18700118d87a390f36cbe9701606f68ee53196e8be514ddcf53d5b0c8",
        "canonical_repository_id": "twpayne/chezmoi",
        "event_id": "be19923c01634dfab6f4ac62678be4bce95dbc38d4d7ad6f68b6fe456132ef12",
        "evidence_channel": "ai_ban_policy_introduction_diffs",
        "exact_agreement": true,
        "language": "Go",
        "primary_decision": "reject",
        "primary_response_sha256": "6c6a95da05a545a0c9f200eb29272866e219980f42ee72ddc107b7d68c5e43a2",
        "task_id": "8298b8e855277838fdfac0f18c93c47195a1de0dca5ddd4231bd552caf3483b1"
      },
      {
        "audit_decision": "reject",
        "audit_response_sha256": "4fe6cb39c43635f6bd4cab52a472670595ea49e5e8a3f03c6921ed1390f32ae8",
        "canonical_repository_id": "superseriousbusiness/gotosocial",
        "event_id": "1a224ee15bf153a76f169d2545036d1a4dc75fef92ec4a96d85ef87d015d6eae",
        "evidence_channel": "ai_ban_policy_files",
        "exact_agreement": true,
        "language": "Go",
        "primary_decision": "reject",
        "primary_response_sha256": "03971c8cdefcad5226cff4d0044a04ac806b1a7f267f6f431154f230ed6751cc",
        "task_id": "8ebfaada506be3709f8e65760970f4ed12c4ebafb8594dabfbe432616844e96d"
      },
      {
        "audit_decision": "accept_policy",
        "audit_response_sha256": "d12b4ae2668d114fccab54dd8a0499ef6396d8b4f89a3db9a8935222a2cfa92d",
        "canonical_repository_id": "wafrn/wafrn",
        "event_id": "b5cae5141a534d689bb7296e750d12c49e82a3b2ebe77add255f6ef6a90543f6",
        "evidence_channel": "ai_ban_policy_introduction_diffs",
        "exact_agreement": true,
        "language": "JSON",
        "primary_decision": "accept_policy",
        "primary_response_sha256": "0ecdcd75059649f22ae9633bb4dc3a793dc641af13992f17b8588c9784f77da1",
        "task_id": "ce1fd9cefd03851cac69f76bb9e529f74af0251984ade0a67f79124ac2766ad6"
      },
      {
        "audit_decision": "accept_policy",
        "audit_response_sha256": "9f1bb0bc2094aae15d860afc29e930b2e58ad979df22fc9087c2a65d3e7531d9",
        "canonical_repository_id": "pouchdb/pouchdb",
        "event_id": "c974fabbe24aa778cd64cf4c502aaafbd24581889be3227837645348582eaa37",
        "evidence_channel": "ai_ban_policy_files+ai_ban_policy_introduction_diffs",
        "exact_agreement": true,
        "language": "JavaScript",
        "primary_decision": "accept_policy",
        "primary_response_sha256": "acc0ecd772571b32f4a6b3a83144bddbfe0548a9a5c1322eb7f3e44d5bd47364",
        "task_id": "cc3a1863090fe901876e4101d59cf67c8dc85a04954b616661396bb552d56a94"
      },
      {
        "audit_decision": "accept_policy",
        "audit_response_sha256": "9514762b6e31f3fb9ebf50c861e4a3e25744ddda52f111b14c8c55fb5a7fba90",
        "canonical_repository_id": "apache/couchdb",
        "event_id": "2097ba918ac3ac3a3dafd225edc8844f61f61900cc073d5d99676b45481a28cf",
        "evidence_channel": "ai_ban_policy_files+ai_ban_policy_introduction_diffs",
        "exact_agreement": true,
        "language": "Erlang",
        "primary_decision": "accept_policy",
        "primary_response_sha256": "cb822ffddfbfb3ae989ac606a66926a1e5356e9b3b54bd45274a59f238aecff0",
        "task_id": "05b3b6d3dc7f7517ac67c444e84295947adf8c4e0b92addc69dc276accf34005"
      },
      {
        "audit_decision": "accept_policy",
        "audit_response_sha256": "4adb740d923dba5b406f149f3dff7e92192a21c2d046f5bb7c2c5978c7939676",
        "canonical_repository_id": "jhy/jsoup",
        "event_id": "f7c95680a46361ccbbd59d2d86c9d46eac2f1407a97894cf252abed45c973072",
        "evidence_channel": "ai_ban_policy_files+ai_ban_policy_introduction_diffs",
        "exact_agreement": true,
        "language": "Java",
        "primary_decision": "accept_policy",
        "primary_response_sha256": "ca7310fb0a6f93ff4498e9c43d0ed2328ced496679348786dd40aa2e46592fdf",
        "task_id": "98d784478a0c9c0c80157327a966c27a7af815e99cfd43d42c77eb58ff691f2d"
      },
      {
        "audit_decision": "accept_policy",
        "audit_response_sha256": "11606cfcbc4cb8fe96b6c654d3b75fa86bf26e61e2c2e77be985fbb504fd1f3f",
        "canonical_repository_id": "endless-sky/endless-sky",
        "event_id": "6f867ffd7480f8547eef09f7753410c84ffa9280a8c9eced4066f7c5d441437b",
        "evidence_channel": "ai_ban_policy_introduction_diffs",
        "exact_agreement": true,
        "language": "Text",
        "primary_decision": "accept_policy",
        "primary_response_sha256": "9c63acbbfa1249a8080ac9a2415eb23c572bd73a43b165fef9a20544ec91e405",
        "task_id": "8a6c4a95abca63aab4688a9fa5a44860c17900e90bcde3f951165881da6238e0"
      },
      {
        "audit_decision": "accept_policy",
        "audit_response_sha256": "a73bc7810cc0f9072a858f38a48be024ef29c0becf155d931f8433fc0a176123",
        "canonical_repository_id": "asahilinux/m1n1",
        "event_id": "a57c36fb1e62b8ad89d1b18f9fcd09472872fa0ab32c7e1355cc82cbe2cb19e0",
        "evidence_channel": "ai_ban_policy_files+ai_ban_policy_introduction_diffs",
        "exact_agreement": true,
        "language": "Python",
        "primary_decision": "accept_policy",
        "primary_response_sha256": "e5767f044ebeb1e6d8ac0ff5049185d9b9e323a2124a21102f79f27507b999ac",
        "task_id": "f18eb0d259c72de94ac46619d1fae0700870293db274cf9e37948a44d83e67b6"
      },
      {
        "audit_decision": "reject",
        "audit_response_sha256": "e35831d2bf6334ba1ff19e30359321934a63b4f6f8fcc1aed04e841df803b185",
        "canonical_repository_id": "yt-dlp/yt-dlp",
        "event_id": "7eebc2d838133a78a64a871c5ce0ecf91463bdde1d4647882ff758e3c6252865",
        "evidence_channel": "ai_ban_policy_files",